id,scheduled_at,platform,imagery,imagery_url,text,drafts
FP-AUTO-101,2026-03-01T09:40:00-05:00,X,Brain Rot text card,,Brain Rot was satire until it sounded like a medical report on my attention span.,"Brain Rot was satire until it sounded like a medical report on my attention span.||Older song, current mood: Brain Rot.||I wrote this as a joke and accidentally told the truth."
FP-AUTO-102,2026-03-01T20:55:00-05:00,TikTok,Brain Rot 9:16 clip + neon overlay,,Too many tabs. One nervous system. #BrainRot,"Too many tabs. One nervous system. #BrainRot||Time is fake, notifications are real.||Brain Rot in 20 seconds."
FP-AUTO-103,2026-03-02T12:25:00-05:00,Instagram,3-panel carousel: doomscroll hand / cracked smile / dark room,https://i.ytimg.com/vi/wGFgXcTD1YE/maxresdefault.jpg,Some songs are clocks. Brain Rot is an alarm.,Some songs are clocks. Brain Rot is an alarm.||You can laugh and panic in the same chorus.||Older song. New weather.
FP-AUTO-104,2026-03-03T19:35:00-05:00,Facebook,Analog+Brain Rot throwback graphic,https://i.ytimg.com/vi/wGFgXcTD1YE/maxresdefault.jpg,"Throwback transmission: from Brain Rot to Analog Myth, same signal different static.","Throwback transmission: from Brain Rot to Analog Myth, same signal different static.||Old songs age into new confessions.||This one still hits too close."
FP-AUTO-105,2026-03-04T10:50:00-05:00,YouTube Shorts,Brain Rot quote card + waveform,,"If this line found you, full signal is on YouTube + lilyroo.com","If this line found you, full signal is on YouTube + lilyroo.com||Subscribe on YouTube — help us hit 1,000.||Short transmission from the archive."
FP-AUTO-106,2026-03-05T21:10:00-05:00,X,Text-only quip,,I keep receipts for feelings.,I keep receipts for feelings.||Tiny difference. Entire life rerouted.||I trust tape hiss more than perfect silence.
FP-AUTO-107,2026-03-06T13:05:00-05:00,Instagram,Analog Myth cover + lyric card,https://i.ytimg.com/vi/wGFgXcTD1YE/maxresdefault.jpg,"If you can’t read clocks, maybe time is just a myth.","If you can’t read clocks, maybe time is just a myth.||Clocks measure numbers, not grief.||New transmission, same old ache."
FP-AUTO-108,2026-03-07T20:20:00-05:00,TikTok,Brain Rot performance clip,,Late again. Right on emotional schedule.,Late again. Right on emotional schedule.||Brain Rot but make it folk punk.||One more transmission before midnight.
