id,song,lyric_excerpt,backstory_id,backstory_summary,source_status,notes
LR-LYRIC-001,Analog Myth,"If you can’t read clocks… maybe time is just a myth",LR-ANEC-003,"Written after staring at a blinking 12:00 clock; time/feeling mismatch.",canon,Primary hook line
LR-LYRIC-002,I Learned It All in Fifteen Seconds,"I've lived a thousand lives alone",LR-ANEC-008,"Came from one long scroll session that felt like a year.",canon,Use for social empathy hooks
LR-LYRIC-003,I Learned It All in Fifteen Seconds,"I keep a charger by my bed",LR-ANEC-006,"Modern-candle metaphor; attachment to feed-era intimacy.",canon,Great for short captions
LR-LYRIC-004,Brain Rot,"(placeholder lyric excerpt)",LR-ANEC-019,"Draft backstory: overstimulated feed life + emotional numbness turning into satire.",draft,Replace excerpt with exact lyric when finalized
LR-LYRIC-005,Guards Down,"We check the screen like it's truth.",LR-ANEC-023,"Pushes back on confusing visibility with honesty.",canon,Primary hook line
LR-LYRIC-006,Guards Down,"No soft version of brave.",LR-ANEC-024,"Decision pressure and courage without a draft mode.",canon,Strong quote-card line
