date,platform,post_id_or_url,content_id,song_era,hook,cta_type,youtube_linked,lilyroo_linked,views,likes,comments,shares,saves,subs_delta,notes
2026-02-28,X,https://x.com/lilyrooartist/status/2027750321322148009,LR-ANEC-001,Analog Myth,"If you can’t read clocks… maybe time is a myth",site_link,no,yes,,,,,,,Posted from approved Option A copy
2026-02-28,Instagram,https://www.instagram.com/p/DURjDIUgVn3/,LR-ANEC-001,Analog Myth,"New Now Playing: Analog Myth",link_in_bio,no,yes,,,,,,,Single image post
2026-02-28,Facebook,posted,LR-ANEC-001,Analog Myth,"Time myth concept + song context",site_link,no,yes,,,,,,,Posted on Lily Roo page
2026-02-28,TikTok,https://www.tiktok.com/@lilyroo930/video/7611932426557754654,LR-ANEC-001,Analog Myth,"If you can’t read clocks…",soft_subscribe,no,yes,,,,,,,Final privacy set to Everyone
2026-04-12,X,https://x.com/lilyrooartist/status/2043354786867589546,,,Dropping the guards didn’t make me better. It made it real.,,no,no,,,,,,,queue_id=FP-AUTO-201; reply_url=https://x.com/lilyrooartist/status/2043354788054573307
2026-04-25,Facebook,https://www.facebook.com/903693509504290_122113878687249470,FP-AUTO-210,Slow Walk,"Slow Walk is a song about setting your own pace while everybody else rushes the same finish line. Watch it on YouTube, then follow the rest of the signal at lilyroo.com.",site_link,yes,yes,,,,,,,queue_id=FP-AUTO-210; posted via Cloudflare Meta Graph API
